Firm,Offering_Nature,Value_Proposition,SME_Focus,Evidence_Notes
Praxis Global Alliance,8,9,7,Analytics-led strategy; benchmarking; cost programs.
Avalon Consulting,6,6,6,"Growth & sector strategy; manufacturing, logistics."
RedSeer,9,8,6,Digital consumer research; startup intelligence.
Faber Infinite,5,6,9,Lean/OpEx implementation; strong SME base.
Vector Consulting Group,4,7,7,TOC supply-chain programs; mid-market reach.
Technopak Advisors,4,4,7,Consumer/retail expertise; PMO programs.
Bain Capability Center (Mid-Market),7,7,4,Scaled analytics & support; less SME-focused.
